{
  "generated_at": "2026-10-12T02:46:58.898Z",
  "status": "building history",
  "method": "Each refresh records the Oracle's decisive forecasts (peaking / accelerating / rising / fading) in data/forecast_ledger.json. 48h later the forecast is compared with the actual velocity history and scored hit/miss. Nothing is backfilled — the log starts 2026-10-11, so the first resolutions land 48h after that.",
  "horizon_hours": 48,
  "resolution_rules": {
    "rising_accelerating": "hit if the actual velocity slope over the 48h window after the forecast is >= +1.5/hr (the classifier's own rising threshold)",
    "peaking": "hit if the highest velocity in the 48h window stays at/below the forecast-time velocity +2 (the top was called, not blown through)",
    "fading": "hit if the actual velocity slope over the 48h window is <= -1.5/hr (the classifier's own falling threshold)"
  },
  "counts": {
    "recorded": 222,
    "pending": 222,
    "resolved": 0,
    "hits": 0
  },
  "hit_rate": null,
  "hit_rate_note": "The Oracle shows its own hit rate once 10 forecasts have resolved; currently 0 resolved.",
  "by_state": {
    "peaking": {
      "resolved": 0,
      "hits": 0
    },
    "accelerating": {
      "resolved": 0,
      "hits": 0
    },
    "rising": {
      "resolved": 0,
      "hits": 0
    },
    "fading": {
      "resolved": 0,
      "hits": 0
    }
  },
  "recent": []
}